{
  "schema": "rafaelia.context_bundle.v2",
  "bundle_id": "CB2-EXAMPLE-READONLY-001",
  "created_at": "2026-09-23T04:00:00Z",
  "intent": {
    "objective": "Open one repository file and one NOVOexport reference for bounded comparison",
    "request_id": "EXAMPLE-001",
    "state": "DECLARED"
  },
  "privacy_class": "PRIVATE",
  "source_generation": {
    "provider": "GOOGLE_DRIVE",
    "generation_id": "novoexport_g2_38bb97724a432420",
    "manifest_ref": "Drive:NOVOexport/export_manifest.json",
    "manifest_sha256": "38bb97724a432420328a322eb27ff1af9de28201c2857448e62d2b2e3a36df4a"
  },
  "resources": [
    {
      "resource_id": "git-1",
      "provider": "GitHub",
      "source": "rafaelmeloreisnovo/RafGitTools",
      "locator": "docs/architecture/RAFGITTOOLS_CONTEXT_WORKBENCH_INTEGRATION_AUDIT_V1.md",
      "object_id": null,
      "ref": "main",
      "sha256": "TOKEN_VAZIO",
      "visibility": "PUBLIC",
      "mime_type": "text/markdown",
      "epistemic_state": "SOURCE_OBSERVED"
    },
    {
      "resource_id": "novo-1",
      "provider": "NOVOexport/Navigator",
      "source": "NOVOexport",
      "locator": "conversation-ref:example",
      "object_id": "TOKEN_VAZIO",
      "ref": "generation:novoexport_g2_38bb97724a432420",
      "sha256": "TOKEN_VAZIO",
      "visibility": "PRIVATE",
      "mime_type": "application/json",
      "epistemic_state": "INDEX_REF"
    }
  ],
  "chunk_refs": [
    "git-1#section:purpose",
    "novo-1#chunk:example"
  ],
  "segments": [],
  "evidence_refs": [
    "GitHub:PR#478",
    "Drive:NOVOexport/export_manifest.json"
  ],
  "constraints": [
    "read-only context acquisition",
    "no model output is execution authority",
    "private corpus bodies are not published"
  ],
  "annotations": {
    "route": "FileBrowser -> ContextBroker -> llamaRafaelia",
    "claim_allowed": false
  },
  "compatibility": {
    "source_schema": "rafaelia.context_bundle.v2",
    "source_variant": "native-v2",
    "adapter": "native",
    "unresolved_fields": [
      "git-1.sha256",
      "novo-1.object_id",
      "novo-1.sha256"
    ],
    "unmapped_keys": []
  }
}
